{
  "$schema": "https://json-schema.org/draft/2020-12/schema",
  "$id": "https://astramem.dev/contracts/atom.v1.schema.json",
  "title": "astramem/atom@1",
  "description": "Canonical Memory Atom v1 (ADR-001). Single schema both astramem-local and AstraMem cloud implement. Additive fields = minor version; breaking changes = new major with a dual-read window.",
  "type": "object",
  "additionalProperties": false,
  "properties": {
    "schema": {
      "const": "astramem/atom@1"
    },
    "id": {
      "type": "string",
      "format": "uuid"
    },
    "type": {
      "type": "string",
      "description": "Registry-extensible, closed by default. v1 registry = the canonical 10-value union ratified by ADR D4 (U4 contract-unification): decision, fact, lesson, command, todo, note, event (astramem-local's 7 today) plus preference, task_result, summary (cloud-only today, until local adds writers). New types are additive (minor version bump); consumers seeing an unknown type should degrade gracefully rather than reject the atom.",
      "enum": ["decision", "fact", "lesson", "command", "todo", "note", "event", "preference", "task_result", "summary"]
    },
    "text": {
      "type": "string",
      "minLength": 1,
      "description": "Canonical normalized text."
    },
    "evidence": {
      "description": "Receipts — never optional. ADR-001 specifies an array of {transcript_id, span} references. Reality: astramem-local v1 stores evidence as a single free-text excerpt string (see src/contracts/memory.ts Memory.evidence, migration 004-provenance.sql). This schema models both forms as the pragmatic contract truth; see contracts/README.md 'Evidence reconciliation' for the migration path from string -> array-of-refs.",
      "anyOf": [
        {
          "type": "string",
          "minLength": 1,
          "description": "Local v1 form: a short free-text excerpt supporting the atom."
        },
        {
          "type": "array",
          "minItems": 1,
          "description": "ADR-001 canonical form: structured receipts pointing at source transcript spans.",
          "items": {
            "type": "object",
            "additionalProperties": false,
            "required": ["transcript_id"],
            "properties": {
              "transcript_id": { "type": "string", "minLength": 1 },
              "span": {
                "type": "array",
                "items": { "type": "integer", "minimum": 0 },
                "minItems": 2,
                "maxItems": 2
              }
            }
          }
        }
      ]
    },
    "confidence": {
      "type": "number",
      "minimum": 0,
      "maximum": 1,
      "description": "Extractor confidence."
    },
    "importance": {
      "type": "number",
      "minimum": 0,
      "maximum": 1
    },
    "provenance": {
      "type": "object",
      "additionalProperties": false,
      "description": "Where this atom came from. Local maps its flat memories columns (agent, session_id, repo, project) plus a static extractor tag onto this object at the wire boundary (see src/contracts/atom-wire.ts).",
      "properties": {
        "tool": {
          "type": ["string", "null"],
          "description": "e.g. claude-code | codex | cursor | runner-plugin"
        },
        "session_id": { "type": ["string", "null"] },
        "repo": { "type": ["string", "null"] },
        "project": { "type": ["string", "null"] },
        "extractor": {
          "type": ["string", "null"],
          "description": "name@version of the extractor that produced this atom."
        }
      }
    },
    "valid_from": {
      "type": "string",
      "format": "date-time",
      "description": "Bitemporal valid-time start."
    },
    "valid_to": {
      "type": ["string", "null"],
      "format": "date-time",
      "description": "Bitemporal valid-time end. null = currently valid."
    },
    "superseded_by": {
      "type": ["string", "null"],
      "format": "uuid"
    },
    "derived_from": {
      "type": ["array", "null"],
      "description": "Consolidation lineage (ADR-004 stage 9).",
      "items": { "type": "string", "format": "uuid" }
    },
    "scope": {
      "type": "string",
      "description": "ADR-009 memory scope. personal is the default.",
      "enum": ["personal", "team", "org"]
    },
    "content_hash": {
      "type": "string",
      "description": "sha256 hex digest — dedup + sync idempotency (ADR-003).",
      "pattern": "^[a-f0-9]{64}$"
    },
    "entities": {
      "type": "array",
      "items": { "type": "string" }
    },
    "created_at": {
      "type": "string",
      "format": "date-time"
    },
    "updated_at": {
      "type": "string",
      "format": "date-time"
    }
  },
  "required": [
    "schema",
    "id",
    "type",
    "text",
    "evidence",
    "confidence",
    "importance",
    "provenance",
    "valid_from",
    "valid_to",
    "scope",
    "content_hash",
    "created_at",
    "updated_at"
  ]
}
