{
  "schema": "astramem/atom@1",
  "id": "00000000-0000-4000-8000-000000000003",
  "type": "lesson",
  "text": "FTS5 negation on '-' breaks unescaped hyphenated queries like 'sqlite-vec'.",
  "evidence": "npm test failed: fts5: syntax error near \"-\"",
  "confidence": 0.85,
  "importance": 0.5,
  "provenance": {
    "tool": "claude-code",
    "session_id": "sess-fts-bug",
    "repo": "astramem-local",
    "project": "astramem",
    "extractor": "astramem-local@0.4.2"
  },
  "valid_from": "2026-05-20T09:00:00.000Z",
  "valid_to": "2026-06-01T00:00:00.000Z",
  "superseded_by": "00000000-0000-4000-8000-000000000004",
  "derived_from": null,
  "scope": "personal",
  "content_hash": "c5b7e3a1d4f6082b3d5e7f9a1c3e5f7092b4d6e8f0a2c4e6f8092b4d6e8f0a2c",
  "entities": ["FTS5"],
  "created_at": "2026-05-20T09:00:00.000Z",
  "updated_at": "2026-06-01T00:00:00.000Z"
}
